{"$defs":{"CausalDigest":{"pattern":"^[0-9a-f]{64}$","type":"string"},"ContentID":{"pattern":"^[0-9a-f]{64}$","type":"string"},"bounded_utf8_registry_string":{"maxLength":128,"minLength":1,"type":"string"},"bounded_utf8_registry_string_256":{"maxLength":256,"minLength":1,"type":"string"},"i128s":{"pattern":"^(0|-?[1-9][0-9]*)$","type":"string"},"rfc3339_full_date":{"pattern":"^[0-9]{4}-[0-9]{2}-[0-9]{2}$","type":"string"},"rfc3339_ns_utc":{"pattern":"^[0-9]{4}-[0-9]{2}-[0-9]{2}T[0-9]{2}:[0-9]{2}:[0-9]{2}\\.[0-9]{9}Z$","type":"string"},"safe_relative_path":{"pattern":"^(?![A-Za-z]:)(?!/)(?!\\.{1,2}(?:/|$))(?!.*(?:/\\.{1,2})(?:/|$))(?!.*//)[^/\\\\:\\x00]+(?:/[^/\\\\:\\x00]+)*$","type":"string"},"sha256":{"pattern":"^[0-9a-f]{64}$","type":"string"},"sq18s":{"pattern":"^(0|-?[1-9][0-9]*)$","type":"string"},"u64s":{"pattern":"^(0|[1-9][0-9]*)$","type":"string"},"uints":{"pattern":"^(0|[1-9][0-9]*)$","type":"string"},"uq18s":{"pattern":"^(0|[1-9][0-9]*)$","type":"string"}},"$id":"urn:build-finance:contract:ledger-record:v1","$schema":"https://json-schema.org/draft/2020-12/schema","additionalProperties":false,"properties":{"causation_ids":{"items":{"$ref":"#/$defs/CausalDigest"},"type":"array","uniqueItems":true},"config_admission_receipt_id":{"$ref":"#/$defs/ContentID"},"decision_sequence":{"anyOf":[{"$ref":"#/$defs/u64s"},{"type":"null"}]},"entries":{"items":{"additionalProperties":false,"properties":{"account":{"enum":["CASH_AVAILABLE","CASH_RESERVED","POSITION_AVAILABLE","POSITION_RESERVED","TRADE_CLEARING","FEE_EXPENSE","REALIZED_PNL","UNREALIZED_PNL","EQUITY_CONTROL"]},"amount_atoms":{"$ref":"#/$defs/i128s"},"asset_mint":{"$ref":"#/$defs/bounded_utf8_registry_string"},"decimals":{"maximum":18,"minimum":0,"type":"integer"}},"required":["account","asset_mint","decimals","amount_atoms"],"type":"object"},"type":"array","uniqueItems":true},"equal_time_group":{"anyOf":[{"$ref":"#/$defs/u64s"},{"type":"null"}]},"fixture_manifest_sha256":{"$ref":"#/$defs/ContentID"},"ingest_sequence":{"anyOf":[{"$ref":"#/$defs/u64s"},{"type":"null"}]},"ledger_record_id":{"$ref":"#/$defs/ContentID"},"ledger_sequence":{"$ref":"#/$defs/u64s"},"object_id":{"$ref":"#/$defs/ContentID"},"object_schema":{"enum":["trading.source-admission-receipt/v1","trading.config-admission-receipt/v1","trading.raw-event/v1","trading.feature-snapshot/v1","trading.model-validation-receipt/v1","trading.model-signal/v1","trading.risk-decision/v1","trading.simulated-order-intent/v1","trading.simulated-fill-receipt/v1","trading.portfolio-state/v1","trading.reconciliation-receipt/v1","trading.run-receipt/v1"]},"object_sha256":{"$ref":"#/$defs/sha256"},"previous_ledger_record_id":{"anyOf":[{"$ref":"#/$defs/ContentID"},{"type":"null"}]},"reconciliation":{"additionalProperties":false,"properties":{"account_residuals":{"items":{"additionalProperties":false,"properties":{"account":{"enum":["CASH_AVAILABLE","CASH_RESERVED","POSITION_AVAILABLE","POSITION_RESERVED"]},"asset_mint":{"$ref":"#/$defs/bounded_utf8_registry_string"},"residual_atoms":{"$ref":"#/$defs/i128s"}},"required":["asset_mint","account","residual_atoms"],"type":"object"},"type":"array","uniqueItems":true},"asset_residuals":{"items":{"additionalProperties":false,"properties":{"asset_mint":{"$ref":"#/$defs/bounded_utf8_registry_string"},"residual_atoms":{"$ref":"#/$defs/i128s"}},"required":["asset_mint","residual_atoms"],"type":"object"},"type":"array","uniqueItems":true},"drawdown_residual_bps":{"$ref":"#/$defs/i128s"},"equity_residual_quote_atoms":{"$ref":"#/$defs/i128s"},"fee_residual_quote_atoms":{"$ref":"#/$defs/i128s"},"peak_equity_residual_quote_atoms":{"$ref":"#/$defs/i128s"},"portfolio_state_id":{"$ref":"#/$defs/ContentID"},"realized_pnl_residual_quote_atoms":{"$ref":"#/$defs/i128s"},"unmatched_reservation_count":{"$ref":"#/$defs/u64s"},"unrealized_pnl_residual_quote_atoms":{"$ref":"#/$defs/i128s"}},"required":["portfolio_state_id","asset_residuals","equity_residual_quote_atoms","unmatched_reservation_count","account_residuals","realized_pnl_residual_quote_atoms","unrealized_pnl_residual_quote_atoms","fee_residual_quote_atoms","peak_equity_residual_quote_atoms","drawdown_residual_bps"],"type":"object"},"record_type":{"enum":["SOURCE_ADMISSION","CONFIG_ADMISSION","RAW_ADMISSION","FEATURE_SNAPSHOT","MODEL_VALIDATION","MODEL_SIGNAL_ACCEPTED","RISK_DECISION","SIMULATED_INTENT","SIMULATED_FILL","PORTFOLIO_STATE","RECONCILIATION","KILL_STATE","RUN_RECEIPT","RUN_END"]},"replay_clock_ns":{"anyOf":[{"$ref":"#/$defs/u64s"},{"type":"null"}]},"run_receipt_id":{"$ref":"#/$defs/ContentID"},"schema":{"const":"trading.ledger-record/v1"},"validated_config_sha256":{"anyOf":[{"$ref":"#/$defs/ContentID"},{"type":"null"}]}},"required":["schema","ledger_record_id","ledger_sequence","previous_ledger_record_id","run_receipt_id","fixture_manifest_sha256","config_admission_receipt_id","validated_config_sha256","record_type","object_schema","object_id","object_sha256","decision_sequence","ingest_sequence","equal_time_group","replay_clock_ns","causation_ids","entries","reconciliation"],"type":"object","x-contract-schema":"trading.ledger-record/v1"}
